{
  "schema": "euclid-min-regular-257-final-pair-line-chord-search/v1",
  "source": {
    "certificate": "construction-69e.json",
    "certificate_sha256": "9b47738d955099547e15369f35cde40fa52c8c5d7594294d372f1ad753c6b10b",
    "full_intersection_closure_report": "full-intersection-closure-69e.json",
    "full_intersection_closure_report_sha256": "c22dc2fec78d560cfd112de01698506ff94e2ecc372897f2c4243cb5c6f28294",
    "candidate_frontier_report": "full-point-candidate-frontier-69e.json",
    "candidate_frontier_report_sha256": "fabd29e6fe05e32b9ec5e102aa67802819a88e060df2be3b5c5ca4f4ed121bf8"
  },
  "semantics": {
    "removed_paid_drawables": [
      "BG0",
      "target_transfer"
    ],
    "selected_paid_drawables": 67,
    "candidate_e_move": 68,
    "candidate_family": "one_line_through_two_available_materialized_exact_points",
    "target_event": "the_two_new_intersections_of_candidate_line_and_c0_are_adjacent",
    "limitations": [
      "尚未检查候选直线产生的新点与既有目标圆点相邻的情形。",
      "尚未检查候选圆，也未物化 474 个抽象残余圆交点。"
    ]
  },
  "universe": {
    "available_points": 2103,
    "available_exact_coordinate_points": 1759,
    "line_definitions": 1546161
  },
  "search": {
    "definitions_tested": 1546161,
    "ball_excluded_definitions": 1546161,
    "exact_checks": 0,
    "solutions": [],
    "solutions_found": 0,
    "status": "exhausted_no_solution"
  }
}
